Threat_ID,Threat_Component_ID,Threat,Threat_Narrative,Attack_Precondition,Component,Phase,Attack_Path,Ease_of_Attack,Impact,Severity,Followup,Comment,Control_ID,Control_Narration,NIST800_53r5_Mapping,Mitre_Tactic_ID,Mitre_Technique_ID
TH045,HOSTOS005,Host OS Filesystem Tampering,An attacker could tamper with the host OS filesystem to gain unauthorized access or escalate privileges.,Misconfigured permissions or weak access controls on the host OS filesystem.,Filesystem,Runtime,Attacker gains access to the host OS filesystem and modifies critical files.,High,Critical,Critical,Implement file integrity monitoring.,null,CN045,Implement file integrity monitoring (FIM) to detect unauthorized modifications to the host OS filesystem.,"CM-2, CM-7",TA0004 (Privilege Escalation)," T1089 (Modify Registry), T1105 (Access Token Manipulation)) "
TH046,CSPM001,Unauthorized Access,An attacker gains unauthorized access to IaaS resources due to weak passwords or misconfigured access controls.,"Weak password policies, Missing Multi-Factor Authentication (MFA).","IaaS resources (Cloud Servers, Storage)",Runtime,Remote access exploit,Medium,"Data Breach, Disruption of Service",High,"Implement strong password policies, Enable MFA, Review access controls.",This is a common threat that can have a significant impact.,CN046,Implement Multi-Factor Authentication (MFA) for all CSPM user accounts.,"AC-17, IA-5",TA0001 (Initial Access)," T1078 (Valid Accounts),  T1135 (Security Policy Bypass))"
TH047,CSPM002,Elevated Privileges,An attacker exploits a vulnerability in a third-party application to gain elevated privileges within the IaaS environment.,Unpatched vulnerabilities in third-party applications.,Third-party application running on IaaS,Runtime,Exploit vulnerability in application,High,Complete System Compromise,Critical,"Patch third-party applications promptly, Implement least privilege principle.",This is a critical threat that requires immediate attention.,CN047,Enforce the principle of least privilege for all CSPM user accounts. Regularly review and update user permissions.,"AC-6, CM-5",TA0004 (Privilege Escalation),T1105 (Access Token Manipulation) is a common technique
TH048,CSPM003,CSPM Agent Vulnerabilities,An attacker exploits a vulnerability in the Cloud Security Posture Management (CSPM) agent to bypass security controls.,Unpatched vulnerabilities in the CSPM agent.,CSPM Agent,Runtime,Exploit vulnerability in agent,Medium,Reduced visibility into security posture,High,"Keep CSPM agent up to date, Implement additional security controls.",This threat can weaken your overall security posture.,CN048,Patch and update CSPM agents promptly to address known vulnerabilities.,"CM-2, CM-3",TA0005 (Defense Evasion),T1190 (Endpoint Security Bypass) is a potential technique
TH049,CSPM004,CSPM Misconfigurations,Misconfigured CSPM alerts allow attackers to remain undetected within the IaaS environment.,Incorrectly configured monitoring rules or alert thresholds.,CSPM configuration,Runtime,Manual configuration errors,Medium,Delayed detection of threats,High,Review and test CSPM configurations regularly.,This threat can make it difficult to detect malicious activity.,CN049,Implement automated configuration management tools to ensure consistent and secure configurations for CSPM agents and resources.,"CM-2, CM-5, CM-7",TA0005 (Defense Evasion),T1197 (Indicators of Compromise Removal) is a potential technique